{
  "schema_version": "selector-seed/v3",
  "request_id": "req-20260312-deploy-001",
  "created_at": "2026-03-12T09:15:00Z",
  "objective": "在 A2 上确认 qwen3-next 的默认 prefill policy，并给出最小部署交付物",
  "requested_artifact": "deployment_artifact_pack",
  "target_object": {
    "kind": "deployment",
    "id": "deploy:qwen3-next:a2:allgather-ep",
    "display_name": "Qwen3-Next on A2 with allgather EP"
  },
  "task_family_candidates": [
    "deployment_execution",
    "design_analysis"
  ],
  "family_confidence": "medium",
  "execution_mode_hint": "direct_atomic_workflow",
  "analysis_depth_hint": "lightweight_design_note",
  "deliverable_contract_hint": "deployment_artifact_pack",
  "normalized_entities": {
    "files": [],
    "symbols": [],
    "entities": [
      "repo.feature.allgather_ep",
      "repo.policy.prefill"
    ],
    "errors": [],
    "models": [
      "qwen3-next"
    ],
    "features": [
      "allgather_ep"
    ],
    "hw": [
      "A2"
    ],
    "commits": [],
    "prs": [],
    "versions": [
      "vllm-ascend@0.13.0"
    ],
    "configs": []
  },
  "evidence_inventory": {
    "evidence_kinds": [
      "user_request_only",
      "runtime_tuple"
    ],
    "has_runtime_tuple": true,
    "has_baseline": false,
    "has_validation_assets": false,
    "inline_refs": []
  },
  "evidence_level": "minimal_intake_ready",
  "execution_context": "local_only",
  "code_change_expectation": "no_change_expected",
  "constraints": {
    "hard_constraints": [
      "不允许修改 vllm-ascend 代码",
      "目标硬件是 A2"
    ],
    "soft_constraints": [
      "优先最小部署路径"
    ]
  },
  "unresolved_slots": [
    "baseline",
    "known_constraints"
  ],
  "confirmation_required": false,
  "confirmation_status": "not_needed",
  "smallest_next_step": "查一个 intake 级别的 baseline/policy capsule，确认该需求是否仍在 deployment_execution 边界内",
  "what_is_missing": [
    "现成脚本或 baseline",
    "已知限制说明"
  ],
  "notes": "若查到必须改代码，应 reroute 到 adaptation 或 design_analysis"
}
