{
  "schema_version": "selector-seed/v3",
  "request_id": "req-20260313-sync-002",
  "created_at": "2026-03-13T10:10:00Z",
  "objective": "把指定上游 patch 回灌到当前 release 分支并输出代码改动包",
  "requested_artifact": "code_change_pack",
  "target_object": {
    "kind": "commit_range",
    "id": "upstream:v0.13.0-patchset-12",
    "display_name": "v0.13.0 patch set 12"
  },
  "task_family_candidates": [
    "upstream_sync",
    "design_analysis"
  ],
  "family_confidence": "high",
  "execution_mode_hint": "spec_plan_workflow",
  "analysis_depth_hint": "full_spec_plan",
  "deliverable_contract_hint": "code_change_pack",
  "normalized_entities": {
    "files": [],
    "symbols": [],
    "entities": [
      "upstream.patchset.v0_13_0_12"
    ],
    "errors": [],
    "models": [],
    "features": [
      "release_sync"
    ],
    "hw": [],
    "commits": [
      "abc1234..def5678"
    ],
    "prs": [],
    "versions": [
      "vllm-ascend@releases/v0.13.0",
      "vllm@v0.13.0"
    ],
    "configs": []
  },
  "evidence_inventory": {
    "evidence_kinds": [
      "user_request_only",
      "code_or_diff"
    ],
    "has_runtime_tuple": false,
    "has_baseline": false,
    "has_validation_assets": false,
    "inline_refs": []
  },
  "evidence_level": "minimal_intake_ready",
  "execution_context": "local_only",
  "code_change_expectation": "code_change_required",
  "constraints": {
    "hard_constraints": [
      "仅允许分析，不允许直接进入代码修改流程"
    ],
    "soft_constraints": [
      "保留影响面说明"
    ]
  },
  "unresolved_slots": [
    "user_confirmation"
  ],
  "confirmation_required": true,
  "confirmation_status": "user_declined",
  "confirmation_reason_codes": [
    "code_change_scope",
    "repo_mutation_scope"
  ],
  "smallest_next_step": "停止代码修改路径，仅可返回影响面分析或让用户稍后重新确认",
  "what_is_missing": [
    "用户确认"
  ],
  "notes": "Intake 必须终止 code-change path，不得产生 selector_plan"
}
