{
  "schema_version": "selector-seed/v3",
  "request_id": "req-20260313-perf-exp-003",
  "created_at": "2026-03-13T13:00:00Z",
  "objective": "估算 qwen3-next-32b 在 A2 上、TP=4、BF16、8k context 下的预期 TTFT、吞吐与显存头寸。",
  "requested_artifact": "analysis_report",
  "target_object": {
    "kind": "model",
    "id": "model:qwen3-next-32b:a2:tp4:bf16:8k",
    "display_name": "Qwen3-Next-32B on A2 TP4 BF16 8k"
  },
  "task_family_candidates": [
    "performance_analysis",
    "deployment_execution"
  ],
  "family_confidence": "high",
  "execution_mode_hint": "direct_atomic_workflow",
  "analysis_depth_hint": "none",
  "deliverable_contract_hint": "analysis_report",
  "normalized_entities": {
    "files": [],
    "symbols": [],
    "entities": [
      "baseline.expectation.qwen3-next-32b.a2",
      "repo.policy.prefill"
    ],
    "errors": [],
    "models": [
      "qwen3-next-32b"
    ],
    "features": [
      "prefill",
      "decode",
      "tp4",
      "bf16"
    ],
    "hw": [
      "A2"
    ],
    "commits": [],
    "prs": [],
    "versions": [
      "vllm-ascend@0.13.0"
    ],
    "configs": [
      "tp4_bf16_ctx8k"
    ]
  },
  "evidence_inventory": {
    "evidence_kinds": [
      "user_request_only",
      "runtime_tuple",
      "baseline_or_expectation"
    ],
    "has_runtime_tuple": true,
    "has_baseline": true,
    "has_validation_assets": false,
    "inline_refs": []
  },
  "evidence_level": "analysis_ready",
  "execution_context": "local_only",
  "code_change_expectation": "no_change_expected",
  "constraints": {
    "hard_constraints": [
      "只做预期性能分析，不做 bug root cause",
      "目标硬件是 A2"
    ],
    "soft_constraints": [
      "优先给范围而不是单点数值",
      "显式写出关键假设"
    ]
  },
  "unresolved_slots": [
    "target batch size"
  ],
  "confirmation_required": false,
  "confirmation_status": "not_needed",
  "smallest_next_step": "查询一个 atomic 级期望性能 capsule，确认最接近的 comparable baseline 和主要敏感因子。",
  "what_is_missing": [
    "最终 batch size",
    "是否启用 graph mode"
  ],
  "notes": "这是 expectation path，不等于真实测量值。"
}
